,rank,stadium,description,capacity,region,country,city,home_team,image_url,location
0,1.0,Rungrado 1st of May Stadium,"The Rungrado 1st of May Stadium is a multi-purpose stadium occupying an area of 20.7 hectares  on Rungra Island, Pyongyang, North Korea. It opened on 1 May 1989, with its first major event being the 13th World Festival of Youth and Students. It is the second-largest stadium in the world by seating capacity. The stadium has a seating capacity of 114,000 spectators.",114000.0,East Asia,North Korea,Pyongyang,"Korea DPR national football team, Korea DPR women's national football team, April 25",https://upload.wikimedia.org/wikipedia/commons/thumb/8/81/Arirang_Mass_Games_12.JPG/150px-Arirang_Mass_Games_12.JPG,"(39.0496732, 125.77532151186813)"
1,2.0,Michigan Stadium,"Formerly -Michigan Stadium was built in 1927 at a cost of $950,000 ) and had an original capacity of 72,000. Prior to the stadium's construction, the Wolverines played football at Ferry Field. Every home game since November 8, 1975 has drawn a crowd in excess of 100,000, an active streak of more than 300 contests. On September 7, 2013, the game between Michigan and the Notre Dame Fighting Irish attracted a crowd of 115,109, a record attendance for a college football game since 1948, and an NCAA single-game attendance record at the time, overtaking the previous record of 114,804 set two years previously for the same matchup.",107601.0,North America,United States,"Ann Arbor, Michigan",Michigan Wolverines football,https://upload.wikimedia.org/wikipedia/commons/thumb/e/ed/Real_Madrid_vs._Machester_United_August_2nd%2C_2014.jpg/150px-Real_Madrid_vs._Machester_United_August_2nd%2C_2014.jpg,"(42.2658652, -83.74868376764053)"
2,3.0,Ohio Stadium,"Ohio Stadium is an American football stadium in Columbus, Ohio, on the campus of Ohio State University. It primarily serves as the home venue of the Ohio State Buckeyes football team and is also the site for the university's Spring Commencement ceremonies each May. Common nicknames for the stadium include ""The Horseshoe"", ""The Shoe"", and ""The House That Harley Built"". -From 1996 to 1998, Ohio Stadium was the home venue for the Columbus Crew of Major League Soccer prior to the opening of Columbus Crew Stadium in 1999. The stadium also was the home venue for the OSU track and field teams from 1923 to 2001. In addition to athletics, Ohio Stadium is also a concert venue, with U2, Taylor Swift, The Rolling Stones, Genesis, Pink Floyd, and Metallica among the many acts to have played at the venue.",102780.0,North America,United States,"Columbus, Ohio",Ohio State Buckeyes football,https://upload.wikimedia.org/wikipedia/commons/thumb/f/fc/Panoramic_view_of_Ohio_Stadium.jpg/150px-Panoramic_view_of_Ohio_Stadium.jpg,"(40.00164575, -83.01973744224524)"
3,4.0,Melbourne Cricket Ground,"The  Melbourne Cricket Ground , also known locally as The 'G, is an Australian sports stadium located in Yarra Park, Melbourne, Victoria. Founded and managed by the Melbourne Cricket Club, with 95,000 seats and an additional 5,000 capacity in standing room for a total of just over 100,000 it is the largest stadium in the Southern Hemisphere, the 11th largest globally, and the second-largest cricket ground by capacity, after the Narendra Modi Stadium. The Colosseum is within walking distance of the city centre and is served by Richmond and Jolimont railway stations, as well as the route 70, route 75, and route 48 trams. It is adjacent to Melbourne Park and is part of the Melbourne Sports and Entertainment Precinct. -Melbourne Football Club   Richmond Football Club  Collingwood Football Club   Essendon Football Club   Hawthorn Football Club   Carlton Football Club",100024.0,Oceania,Australia,"Melbourne, Victoria","Australia national cricket team, Victoria cricket team, Melbourne Cricket Club, Melbourne Stars, Melbourne FC, Richmond FC, Collingwood FC, Hawthorn FC",https://upload.wikimedia.org/wikipedia/commons/thumb/b/b4/MCG_Panorama_24_July_2015.jpg/150px-MCG_Panorama_24_July_2015.jpg,"(-37.819908999999996, 144.98322500667754)"
4,5.0,Camp Nou,"-Camp Nou , meaning New Field, often referred to in English as the Nou Camp, currently known as Spotify Camp Nou for sponsorship reasons) is a stadium in Barcelona and the home of La Liga club Barcelona since its opening in 1957.It is currently undergoing renovation, and with a planned increased seating capacity of 105,000, it will be the stadium with the largest capacity in Spain and Europe, and the second largest football stadium in the world.",99354.0,Europe,Spain,"Barcelona, Catalonia",FC Barcelona,https://upload.wikimedia.org/wikipedia/commons/thumb/0/0e/Camp_Nou_Experience_%28_Ank_Kumar%2C_INFOSYS_Limited_%29_07.jpg/150px-Camp_Nou_Experience_%28_Ank_Kumar%2C_INFOSYS_Limited_%29_07.jpg,"(41.3807673, 2.1158684)"
5,6.0,Estadio Azteca,"Estadio Azteca ) is a football stadium located in Coyoacán, Mexico City. It is the official home of football team Club América, as well as the Mexico national team. The stadium sits at an altitude of 2,200 m  above sea level. With a capacity of 87,523, it is the largest stadium in Latin America and the sixth-largest association football stadium in the world. -Regarded as one of the most famous and iconic football stadiums in the world, it is the first to have hosted two FIFA World Cup finals; the 1970 World Cup final, where Brazil defeated Italy 4–1, and the 1986 World Cup final, where Argentina defeated West Germany 3–2. It also hosted the 1986 quarter-final match between Argentina and England in which Diego Maradona scored both the ""Hand of God goal"" and the ""Goal of the Century"". The Estadio Azteca is the only football stadium in the world to have both Pelé  and Diego Maradona  win the FIFA World Cup, both of whom are considered among the greatest football players of all time. The stadium also hosted the ""Game of the Century"", when Italy defeated West Germany 4–3 in extra time in one of the 1970 semifinal matches. The stadium was also the principal venue for the football tournament of the 1968 Summer Olympics and the 1971 Women's World Cup. The stadium is scheduled to host games during the 2026 FIFA World Cup, including the opening game, making it the only stadium to host three editions of the FIFA World Cup.",95500.0,North America,Mexico,Mexico City,"Club América, Cruz Azul, Mexico national football team",https://upload.wikimedia.org/wikipedia/commons/thumb/c/ca/Panor%C3%A1mica_esquina_noreste.jpg/150px-Panor%C3%A1mica_esquina_noreste.jpg,"(19.302979399999998, -99.1504699525862)"
6,7.0,FNB Stadium,"First National Bank Stadium or simply FNB Stadium , also known as Soccer City  and The Calabash, is an association football  and Rugby union stadium located in Nasrec, bordering the Soweto area of Johannesburg, South Africa. The site is managed by Stadium Management South Africa  and is home of Kaizer Chiefs F.C. in the South African Premier Soccer League as well as the venue for key fixtures for the South Africa national football team. -It is located next to the South African Football Association headquarters  where both the FIFA offices and the Local Organising Committee for the 2010 FIFA World Cup are housed. Designed as the main association football stadium for the 2010 World Cup, the FNB Stadium became the largest stadium in Africa with a capacity of 94,736. However, its maximum capacity during the 2010 FIFA World Cup was 84,490 due to reserved seating for the press and VIPs. The stadium is also known by its nickname ""The Calabash"" due to its resemblance to the African pot or gourd.",94736.0,Africa,South Africa,"Johannesburg, Gauteng","South Africa national football team, Kaizer Chiefs",https://upload.wikimedia.org/wikipedia/commons/thumb/c/c0/First_game_of_the_2010_FIFA_World_Cup%2C_South_Africa_vs_Mexico.jpg/150px-First_game_of_the_2010_FIFA_World_Cup%2C_South_Africa_vs_Mexico.jpg,"(-26.234706250000002, 27.98264390042038)"
7,8.0,New Administrative Capital Stadium,"It is part of the Egypt International Olympic City, a large sports complex that has been under construction since 2015. It will have a training ground, two indoor halls , an Olympic-size swimming pool, and other buildings, and is being built with an eye toward the country's possible bids for the Olympic Games or the FIFA World Cup.",93940.0,Africa,Egypt,New Administrative Capital,Egypt national football team,https://upload.wikimedia.org/wikipedia/commons/thumb/e/e0/The_New_administrative_stadium_of_Egypt.jpg/150px-The_New_administrative_stadium_of_Egypt.jpg,
8,9.0,Rose Bowl Stadium,"The Rose Bowl is an outdoor athletic stadium located in Pasadena, California. Opened in October 1922, the stadium is recognized as a National Historic Landmark and a California Historic Civil Engineering landmark. At a modern capacity of an all-seated configuration at 96,400, the Rose Bowl is the 16th-largest stadium in the world, the 11th-largest stadium in the United States, and the 10th-largest NCAA stadium. The stadium is 10 miles  northeast of downtown Los Angeles. -The Rose Bowl is best known as a college football venue, specifically as the host of the annual Rose Bowl Game for which it is named. Since 1982, it has served as the home stadium of the UCLA Bruins football team of the Big Ten Conference. Five Super Bowl games, third most of any venue, have been played in the stadium. The Rose Bowl is a noted soccer venue, having hosted the 1994 FIFA World Cup Final, 1999 FIFA Women's World Cup Final, and the 1984 Olympic Soccer Gold Medal Match, as well as numerous CONCACAF and United States Soccer Federation matches.",92800.0,North America,United States,"Pasadena, California",UCLA Bruins,https://upload.wikimedia.org/wikipedia/commons/thumb/d/d2/Rose_Bowl%2C_panorama.jpg/150px-Rose_Bowl%2C_panorama.jpg,"(34.16134915000001, -118.16766739828785)"
9,10.0,Cotton Bowl Stadium,"The Cotton Bowl is an outdoor stadium in Dallas, Texas, United States. Opened in 1930 as Fair Park Stadium, it is on the site of the State Fair of Texas, known as Fair Park. -The Cotton Bowl was the longtime home of the annual college football post-season bowl game known as the Cotton Bowl Classic, for which the stadium is named. Starting on New Year's Day 1937, it hosted the first 73 editions of the game, through January 2009; the game was moved to AT&T Stadium in Arlington in January 2010. The stadium also hosts the Red River Rivalry, the annual college football game between the Oklahoma Sooners and the Texas Longhorns, and formerly, the First Responder Bowl.",92100.0,North America,United States,"Dallas, Texas",,https://upload.wikimedia.org/wikipedia/commons/thumb/5/52/2019_State_Fair_Classic_01_%28Cotton_Bowl%29.jpg/150px-2019_State_Fair_Classic_01_%28Cotton_Bowl%29.jpg,"(32.77961185, -96.7596025290281)"
10,11.0,Wembley Stadium,"Wembley Stadium  is an association football stadium in Wembley, London. It opened in 2007 on the site of the original Wembley Stadium, which had stood from 1923 until 2003. The stadium is England's national football stadium, and thus hosts the majority of the England national team home matches and the FA Cup Final – the final of England's primary domestic club football competition. It is widely regarded as one of the most iconic football stadiums in the world, and is considered a hub for the English game. Wembley Stadium is owned by the governing body of English football, the Football Association, whose headquarters are in the stadium, through its subsidiary Wembley National Stadium Ltd . With 90,000 seats, it is the largest stadium in the UK and the second-largest stadium in Europe, behind Barcelona's Camp Nou. -Designed by Populous and Foster and Partners, the stadium is crowned by the 134-metre-high  Wembley Arch which serves aesthetically as a landmark across London as well as structurally, with the arch supporting over 75% of the entire roof load. The stadium was built by Australian firm Multiplex at a cost of £798 million . Two partially retractable roof structures over the east and west ends of the stadium can be opened to allow sunlight and aid pitch growth.",90000.0,"Europe
",England,"London, England",England national football team,https://upload.wikimedia.org/wikipedia/commons/thumb/b/bb/Post_L2_Play-Off_Final.jpg/150px-Post_L2_Play-Off_Final.jpg,"(51.55606945, -0.27960339379401444)"
11,12.0,Lusail Stadium,"Lusail Stadium  ALA-LC: Istād Lūsayl) is a football stadium in Lusail, Qatar. Owned by the Qatar Football Association, it is the largest stadium in Qatar and the Middle East by capacity; one of eight stadiums built for the 2022 FIFA World Cup, it hosted the 2022 FIFA World Cup final game between Argentina and France on 18 December 2022. It is currently the second largest football stadium in Asia but eventually will reduce its current capacity of 88,966 to 40,000 in the near future. -The stadium is located about 20 kilometres  north of Doha, in the city of Lusail. Lusail Stadium was inaugurated on 9 September 2022 with the Lusail Super Cup game.",88966.0,"West Asia
",Qatar,Lusail,Qatar national football team,https://upload.wikimedia.org/wikipedia/en/thumb/a/a3/Lusail_Stadium.jpg/150px-Lusail_Stadium.jpg,"(25.42152245, 51.48437320749761)"
12,13.0,Bukit Jalil National Stadium,"The Bukit Jalil National Stadium  is a multi-purpose stadium in Bukit Jalil, Kuala Lumpur, Malaysia. With a capacity of 87,500, it is the largest stadium in Southeast Asia, the fourth largest in Asia, and the fifteenth largest in the world. -It was officially inaugurated by then Prime Minister of Malaysia Mahathir Mohamad on 11 July 1998 ahead of the 1998 Commonwealth Games and staged its opening ceremony. Since then, it has also become the main venue for other international multi-sport events such as the 2001 Southeast Asian Games and the 2017 Southeast Asian Games, and nowadays hosts most Malaysian international football matches, national level football competition finals such as the Malaysia FA Cup, Malaysia Cup, athletic events and music concerts.",87411.0,Southeast Asia,Malaysia,Kuala Lumpur,Malaysia national football team[13],https://upload.wikimedia.org/wikipedia/commons/thumb/a/a1/National_Stadium_Bukit_Jalil_2018_AFF_Suzuki_Cup_final.png/150px-National_Stadium_Bukit_Jalil_2018_AFF_Suzuki_Cup_final.png,"(3.0546755, 101.69136903264581)"
13,14.0,Borg el-Arab Stadium,"The stadium is 145 feddans , is surrounded by a fence which is 3 km long, an internal road network measuring 6 km, a parking lot which could fit 5,000 cars and 200 buses. The stadium also has an airstrip. There are 136 electronic entrances. The main cabin is covered by an umbrella which covers 35% of the stadium's total area. -The stadium is air-conditioned. There are 2 sub-stadiums for training and each ground can hold 2,000 spectators, includes 2 locker rooms and a stadium for Athletics. The stadium also includes a hotel for 200 guests. The stadium includes a building which contains 300 presses.",86000.0,Africa,Egypt,Alexandria,"Egypt national football team, Al Ittihad, Smouha",https://upload.wikimedia.org/wikipedia/commons/thumb/1/1a/Borg_el_arab_stadium.jpg/150px-Borg_el_arab_stadium.jpg,"(30.999469599999998, 29.729432153566332)"
14,15.0,Estadio Santiago Bernabéu,"Santiago Bernabéu Stadium  ⓘ) is a football stadium in Madrid, Spain. With a seating capacity of 80,000, the stadium has the second-largest seating capacity for a football stadium in Spain. It has been the home stadium of Real Madrid since its completion in 1947. -Named after footballer and legendary Real Madrid president Santiago Bernabéu , the stadium is one of the world's most famous football venues. It has hosted the final of the European Cup/UEFA Champions League on four occasions: in 1957, 1969, 1980, 2010. The stadium also hosted the second leg of the 2018 Copa Libertadores Finals, making Santiago Bernabéu the first  stadium to host the two most important premier continental cup finals .",85000.0,Europe,Spain,Madrid,Real Madrid,https://upload.wikimedia.org/wikipedia/commons/thumb/0/0e/Estadio_Santiago_Bernab%C3%A9u_Madrid.jpg/150px-Estadio_Santiago_Bernab%C3%A9u_Madrid.jpg,"(40.4530225, -3.6874219587470445)"
15,16.0,Estadio Mâs Monumental,"It was opened on 26 May 1938 and named after former club president Antonio Vespucio Liberti . It is the largest stadium in both Argentina and all of South America with a capacity of 86,049 and is also home of the Argentina national football team. It was the main venue in the 1951 Pan American Games. It hosted the 1978 FIFA World Cup Final between Argentina and the Netherlands. It has also hosted four finals of the Copa América, most recently in 2011.",84567.0,South America,Argentina,Buenos Aires,"Argentina national football team, River Plate",https://upload.wikimedia.org/wikipedia/commons/thumb/c/c8/Estadio_Monumental.jpg/150px-Estadio_Monumental.jpg,"(-34.54529325, -58.44973852292808)"
16,17.0,Stadium Australia,"Stadium Australia, commercially known as Accor Stadium, is a multi-purpose stadium located in Sydney Olympic Park, a suburb of Sydney, New South Wales, Australia. The stadium, which is sometimes referred to as Sydney Olympic Stadium, Homebush Stadium or simply the Olympic Stadium, was completed in March 1999 at a cost of A$690 million to host the 2000 Summer Olympics. The Stadium was leased by a private company, the Stadium Australia Group, until the Stadium was sold back to the NSW Government on 1 June 2016 after NSW Premier Michael Baird announced the Stadium was to be redeveloped as a world-class rectangular stadium. The Stadium is owned by Venues NSW on behalf of the NSW Government. -New South Wales Blues Canterbury-Bankstown Bulldogs South Sydney Rabbitohs   St George Illawarra Dragons   Wests Tigers   Parramatta Eels",83500.0,Oceania,Australia,"Sydney, New South Wales","South Sydney Rabbitohs, Canterbury-Bankstown Bulldogs, New South Wales Blues, New South Wales Waratahs, Australia men's national soccer team, Australia national rugby union team",https://upload.wikimedia.org/wikipedia/commons/thumb/f/f7/State_of_Origin_Game_II_2018.jpg/150px-State_of_Origin_Game_II_2018.jpg,"(-33.8471082, 151.06338484469373)"
17,18.0,MetLife Stadium,"MetLife Stadium is an open-air multi-purpose stadium at the Meadowlands Sports Complex in East Rutherford, New Jersey, 5 mi  west of New York City. Opened in 2010 to replace Giants Stadium, it serves as the home for the New York Giants and New York Jets of the National Football League , and is also scheduled to host the final of the 2026 FIFA World Cup. At an approximate cost of $1.6 billion, it was the most expensive stadium built in the United States at the time of its completion. -  NJT Bus: 353",82500.0,North America,United States,"East Rutherford, New Jersey","New York Giants, New York Jets, United States men's national soccer team",https://upload.wikimedia.org/wikipedia/commons/thumb/5/54/Copa_America_game_between_Columbia_vs_Peru_at_the_MetLife_Stadium.jpg/150px-Copa_America_game_between_Columbia_vs_Peru_at_the_MetLife_Stadium.jpg,"(40.81352375, -74.07340074891175)"
18,19.0,Croke Park,"Croke Park ) is a Gaelic games stadium in Dublin, Ireland. Named after Archbishop Thomas Croke, it is referred to as Croker by GAA fans and locals. It serves as both the principal national stadium of Ireland and headquarters of the Gaelic Athletic Association . Since 1891 the site has been used by the GAA to host Gaelic sports, including the annual All-Ireland finals in Gaelic football and hurling. -A major expansion and redevelopment of the stadium ran from 1991 to 2005, raising capacity to its current 82,300 spectators. This makes Croke Park the fourth-largest stadium in Europe, and the largest not usually used for association football in Europe.",82300.0,Europe,Ireland,Dublin,"Gaelic Athletic Association, Dublin GAA",https://upload.wikimedia.org/wikipedia/commons/thumb/9/91/Croke_park_all_ireland.jpg/150px-Croke_park_all_ireland.jpg,"(53.36035755, -6.2509811826224695)"
19,20.0,Jakarta International Stadium,"Jakarta International Stadium  is a retractable roof football stadium in Tanjung Priok, Jakarta, Indonesia. It is the home ground of Persija Jakarta after moving from their previous stadium, Gelora Bung Karno Stadium, and the occasional home of the Indonesia national football team, after an agreement between PSSI and PT JAKPRO to use the facility. The stadium has a seating capacity of 82,000 spectators, making it the largest stadium in Indonesia and largest football-specific stadium in Asia. -Construction of the stadium was delayed due to land disputes and class-action lawsuits by former squatters whose homes were demolished to make way for the stadium. Construction of the stadium started in September 2019 and completed in April 2022. After numerous delays and preparations, the stadium opened for its grand opening on 24 July 2022.",82000.0,"Southeast Asia
",Indonesia,Jakarta,"Persija Jakarta, Indonesia national football team",https://upload.wikimedia.org/wikipedia/commons/thumb/b/b2/Jakarta_International_Stadium_interior.jpg/150px-Jakarta_International_Stadium_interior.jpg,"(-6.12507475, 106.86020095899971)"
20,21.0,Lambeau Field,"Lambeau Field is an outdoor athletic stadium in the north central United States, located in Green Bay, Wisconsin. The home field of the Green Bay Packers of the National Football League , it opened in 1957 as City Stadium, replacing the original City Stadium at Green Bay East High School as the Packers' home field. Informally known as New City Stadium for its first eight seasons, it was renamed in August 1965 in memory of Packers founder, player, and long-time head coach, Earl “Curly” Lambeau, who had died two months earlier. -With a seating capacity of 81,441, Lambeau Field is the second-largest stadium in the NFL. It is now the largest venue in the State of Wisconsin, edging out Camp Randall Stadium  at the University of Wisconsin in Madison. The playing field at the stadium has a conventional north–south alignment, at an elevation of 640 feet  above sea level.",81441.0,North America,United States,"Green Bay, Wisconsin",Green Bay Packers,https://upload.wikimedia.org/wikipedia/commons/thumb/2/27/Lambeau_Field_bowl.jpg/150px-Lambeau_Field_bowl.jpg,"(44.50095825, -88.06103404376007)"
21,22.0,SIGNAL IDUNA PARK,"Westfalenstadion  ⓘ, lit. 'Westphalia stadium') is a football stadium in Dortmund, North Rhine-Westphalia, Germany, which is the home of Borussia Dortmund. Officially called Signal Iduna Park  for sponsorship reasons and BVB Stadion Dortmund in UEFA competitions, the name derives from the former Prussian province of Westphalia.   -It has a league capacity of 81,365  and an international capacity of 65,829 . It is Germany's largest stadium, the seventh-largest in Europe, and the third-largest home to a top-flight European club after Camp Nou and Santiago Bernabéu Stadium. It holds the European record for average fan attendance, set in the 2011–12 season with almost 1.37 million spectators over 17 games at an average of 80,588 per game. Sales of annual season tickets amounted to 55,000 in 2015.",81365.0,Europe,Germany,Dortmund,Borussia Dortmund,https://upload.wikimedia.org/wikipedia/commons/thumb/3/38/Signal_iduna_park.jpg/150px-Signal_iduna_park.jpg,"(51.4924922, 7.451854850900588)"
22,23.0,Stade de France,"Stade de France , lit. 'Stadium of France') is the national stadium of France, located just north of Paris in the commune of Saint-Denis. Its seating capacity of 80,698 makes it the largest stadium in France. The stadium is used by the French national football and rugby union teams for international competitions. It is the largest in Europe for athletics events, seating 77,083 in that configuration. During other events, the stadium's running track is mostly hidden under the football pitch.  -Originally built for the 1998 FIFA World Cup, the stadium's name was recommended by Michel Platini, head of the organising committee. On 12 July 1998, France beat Brazil 3–0 in the 1998 FIFA World Cup Final contested at the stadium. It will host the athletics events and the closing ceremonies of the 2024 Summer Olympics and 2024 Summer Paralympics.",81338.0,Europe,France,Saint-Denis,France national football team,https://upload.wikimedia.org/wikipedia/commons/thumb/5/53/StadeFranceNationsLeague2018.jpg/150px-StadeFranceNationsLeague2018.jpg,"(48.924472550000004, 2.3601325226927248)"
23,24.0,Grand Sports Arena of the Luzhniki Olympic Complex,"The Grand Sports Arena of the Luzhniki Olympic Complex, commonly known as Luzhniki Stadium, is the national stadium of Russia, located in its capital city, Moscow. Its total seating capacity of 81,000 makes it the largest football stadium in Russia and the ninth-largest stadium in Europe. The stadium is a part of the Luzhniki Olympic Complex, and is located in Khamovniki District of the Central Administrative Okrug of Moscow city. The name Luzhniki derives from the flood meadows in the bend of Moskva River where the stadium was built, translating roughly as ""The Meadows"". The stadium is located at Luzhniki Street, 24, Moscow. -Luzhniki was the main stadium of the 1980 Olympic Games, hosting the opening and closing ceremonies, as well as some of the competitions, including the athletics and final of the football tournament. A UEFA Category 4 stadium, Luzhniki hosted the UEFA Cup final in 1999 and UEFA Champions League final in 2008. The stadium also hosted such events as Summer Universiade, Goodwill Games and World Athletics Championships. It was the main stadium of the 2018 FIFA World Cup and hosted 7 matches of the tournament, including the opening match and the final.",81000.0,Europe,Russia,Moscow,,https://upload.wikimedia.org/wikipedia/commons/thumb/3/3c/Luzhniki_Stadium2.jpg/150px-Luzhniki_Stadium2.jpg,"(55.7157445, 37.553767298728005)"
