,rank,stadium,description,capacity,region,country,city,home_team,image_url,location
156,157.0,National Stadium,"Completed in 2009, it is used mostly for football matches and it hosted the main events for the 2009 World Games. The stadium has a capacity of 55,000 people. Since the conclusion of the games, the stadium has been used for some Taiwanese football team matches. -The stadium, designed by Japanese architect Toyo Ito, makes use of 1 MW of solar cells to provide most of its power needs. The stadium's semi spiral-shaped, like a dragon, is the first stadium in the world to provide power using solar power technology. The solar panels covering the vast external face of the stadium are able to generate most of the power required for its own operation, as well as additional power that can be sent to the grid.",55000.0,East Asia,Taiwan,Kaohsiung,Chinese Taipei national football team,https://upload.wikimedia.org/wikipedia/commons/thumb/5/5f/The_Main_Stadium_for_2009_World_Games_panorama.jpg/150px-The_Main_Stadium_for_2009_World_Games_panorama.jpg,"(22.70285345, 120.29363310033875)"
157,158.0,He Long Stadium,"The stadium is currently used mostly for football matches. It holds 55,000 people, and was constructed in 1987. The stadium is an all-seater, with a roof covering all spectators.",55000.0,East Asia,China,"Changsha, Hunan",,https://upload.wikimedia.org/wikipedia/commons/thumb/7/75/Helong_Stadium.jpg/150px-Helong_Stadium.jpg,"(28.181759, 112.97738969646085)"
158,159.0,Cape Town Stadium,"The Cape Town Stadium  known until 2025 as the DHL Stadium for sponsorship reasons) is an association football  and rugby union stadium in Cape Town, South Africa, that was built for the 2010 FIFA World Cup. During the planning stage, it was known as the Green Point Stadium, which was the name of the older stadium on an adjacent site, and this name was also used frequently during World Cup media coverage. It is the home ground of WP Rugby and the DHL Stormers , Premier Soccer League clubs Cape Town Spurs  and Cape Town City . It has also hosted the South Africa Sevens rugby tournament since 2015 and hosted the Rugby 7s World Cup in 2022. -The stadium is located in Green Point, between Signal Hill and the Atlantic Ocean, close to the Cape Town city center and to the Victoria & Alfred Waterfront, a popular tourist and shopping venue. The stadium had a seating capacity of 64,100 during the 2010 World Cup, later reduced to 58,309. The stadium is connected to the waterfront by a new road connection, Granger Bay Boulevard. Cape Town Stadium is the fifth biggest stadium in South Africa and the biggest in Cape Town.",55000.0,Africa,South Africa,"Cape Town, Western Cape","Cape Town City FC, DHL Western Cape Stormers",https://upload.wikimedia.org/wikipedia/commons/thumb/0/06/Cape_Town_Stadium_Inside.jpg/150px-Cape_Town_Stadium_Inside.jpg,"(-33.903460100000004, 18.411145824940803)"
159,160.0,Plovdiv Stadium,"Stadion Plovdiv  is a multi-purpose stadium in Plovdiv, Bulgaria. It is currently used mostly for athletics championships. The stadium holds 55,000. The stadium was built in 1950. -The stadium initially had a capacity of about 30,000 spectators and had lights. Near the end of the 1980s, a substantial renovation and expansion project began, but was never finished due to a lack of funding. The stadium's present condition is dire, with no UEFA licence, no lights, and only a few games played there . It is the only stadium in Bulgaria with two-storey stands. The biggest events held in the stadium were a 1990 Lepa Brena concert, a 1999 Metallica concert, and the 1990 World Junior Championships in Athletics.",55000.0,Europe,Bulgaria,Plovdiv,,https://upload.wikimedia.org/wikipedia/commons/thumb/0/0c/Plovdiv_Stadium.JPG/150px-Plovdiv_Stadium.JPG,"(42.14970905, 24.7198409279892)"
160,161.0,Bobby Dodd Stadium,"Bobby Dodd Stadium at Hyundai Field is the football stadium located at the corner of North Avenue at Techwood Drive on the campus of the Georgia Institute of Technology in Atlanta. It has been home to the Georgia Tech Yellow Jackets football team, often referred to as the ""Ramblin' Wreck"", in rudimentary form since 1905 and as a complete stadium since 1913. The team participates in the NCAA Division I Football Bowl Subdivision as a member of the Atlantic Coast Conference. It is the oldest stadium in the FBS and has been the site of more home wins than any other FBS stadium. -Former capacity:",55000.0,North America,United States,Atlanta,Georgia Tech Yellow Jackets football,https://upload.wikimedia.org/wikipedia/commons/thumb/a/a4/BDS2013.jpg/150px-BDS2013.jpg,"(33.772476, -84.39295889500981)"
161,162.0,Johan Cruijff Arena,"The Johan Cruyff Arena ; officially stylised as Johan Cruijff ArenA) is the main stadium of the Dutch capital city of Amsterdam and the home stadium of football club AFC Ajax since its opening. Built from 1993 to 1996 at a cost equivalent to €140 million, it is the largest stadium in the country. The stadium was previously known as the Amsterdam Arena  until the 2018–19 football season, when it was officially renamed in honour of Dutch footballer Johan Cruyff who died in 2016. -It was one of the stadiums used during UEFA Euro 2000, and also held the 1998 UEFA Champions League Final and 2013 UEFA Europa League Final. The stadium also hosted three group stage matches and one match in the round of 16 of the UEFA Euro 2020.",54990.0,Europe,Netherlands,Amsterdam,AFC Ajax,https://upload.wikimedia.org/wikipedia/commons/thumb/7/73/Ajax_0_Chelsea_1_%2823Oct19%29.jpg/150px-Ajax_0_Chelsea_1_%2823Oct19%29.jpg,"(52.314353049999994, 4.942843089053988)"
162,163.0,Tianhe Stadium,"Tianhe Stadium   is a multi-purpose stadium in Tianhe District, Guangzhou, Guangdong, China. It is currently used for football matches.",54856.0,East Asia,China,"Guangzhou, Guangdong",,https://upload.wikimedia.org/wikipedia/commons/thumb/1/1f/Tianhe_Stadium.jpg/150px-Tianhe_Stadium.jpg,"(23.1405033, 113.3193596628767)"
163,164.0,Stadio Diego Armando Maradona,"Stadio Diego Armando Maradona, formerly known as Stadio San Paolo, is a stadium in the western Fuorigrotta suburb of Naples, Italy. It is the fourth largest football stadium in Italy, after Milan's San Siro, Rome's Stadio Olimpico and Bari's San Nicola. For the 1960 Summer Olympics in Rome, the stadium hosted the football preliminaries. It is currently used mostly for football matches and is the home stadium of SSC Napoli. Constructed in 1959, the stadium was extensively renovated in 1989 for the 1990 World Cup and again in 2018. The stadium currently accommodates 60,240 spectators, but in the past with terraced sections, the stadium took close to 90,000.",54726.0,Europe,Italy,Naples,SSC Napoli,https://upload.wikimedia.org/wikipedia/commons/thumb/f/f0/Braciere_olimpico_XXX_Universiade_Napoli_2019.jpg/150px-Braciere_olimpico_XXX_Universiade_Napoli_2019.jpg,"(40.82797725, 14.192888963935296)"
164,165.0,Tianjin Olympic Sports Centre Stadium,"The stadium hosted games for the 2007 FIFA Women's World Cup and Football preliminaries at the 2008 Summer Olympics. It also hosted the Athletics competitions at the 2017 National Games of China. -It covers 78,000 square meters and has a capacity of 54,696 seats. It as a length of 380 meters , a width of 270 meters , and a height of 53 meters. The stadium is nicknamed ""The Water Drop"" because the outside of the venue was designed to resemble a drop of water. The stadium cost nearly 1.5 billion Yuan. The architects were AXS Satow.",54696.0,East Asia,China,Tianjin,Tianjin Teda,https://upload.wikimedia.org/wikipedia/commons/thumb/7/72/Tianjin_Olympic_Center_Stadium.jpg/150px-Tianjin_Olympic_Center_Stadium.jpg,"(39.3032619, 117.4163641)"
165,166.0,MERKUR SPIEL-ARENA,"Merkur Spiel-Arena , previously known as the Esprit Arena , the LTU Arena , and also called the Düsseldorf Arena , is a retractable roof football stadium in Düsseldorf, Germany. The arena currently hosts association football team Fortuna Düsseldorf.",54600.0,Europe,Germany,Düsseldorf,Fortuna Düsseldorf,https://upload.wikimedia.org/wikipedia/commons/thumb/a/a7/LTU_arena_panorama.jpg/150px-LTU_arena_panorama.jpg,"(51.261629049999996, 6.73315161013141)"
166,167.0,Boris Paitchadze Dinamo Arena,"The Boris Paitchadze Dinamo Arena , formerly known as Boris Paitchadze National Stadium, is a stadium in Tbilisi, Georgia, and the home stadium of Dinamo Tbilisi, Georgia national rugby union team and Georgia national football team. With a capacity of 54,202, the stadium is the largest in Georgia. Built in 1976 by the Georgian architect Gia Kurdiani, the Dinamo Arena was named Vladimir Ilyich Lenin Dinamo Stadium after Russian Communist leader but later, in 1995 was renamed Boris Paitchadze National Stadium after the famous Georgian football player Boris Paichadze . Prior to the construction of Boris Paitchadze Dinamo Arena, the home stadium of Dinamo Tbilisi was the Central Stadium with an approximate capacity of 35,000 spectators. The demand for a much bigger stadium was increased with the successful performance of Dinamo Tbilisi in the mid 1970s. After the inauguration of the stadium, it became the third-largest in the Soviet Union, with a capacity of 74,354 spectators.",54549.0,West Asia,Georgia,Tbilisi,"Georgia national football team, FC Dinamo Tbilisi",https://upload.wikimedia.org/wikipedia/commons/thumb/3/38/Boris_Paichadze_Dinamo_Arena%2C_Samtredia_-_Qaraba%C4%9F.jpg/150px-Boris_Paichadze_Dinamo_Arena%2C_Samtredia_-_Qaraba%C4%9F.jpg,"(41.7230795, 44.78980579217172)"
167,168.0,Wuhan Sports Centre Stadium,"Local football team Wuhan Guanggu played some high attendance matches at the stadium. It was one of the venues for the 2007 FIFA Women's World Cup and the sole venue for the final stage of the 2015 EAFF East Asian Cup. Football club Wuhan Zall were tenants. They drew an average home attendance of 14,403 in their inaugural top division league season in 2013. Currently, it is the home of Wuhan Three Towns. -The stadium also hosted the 2015 Asian Athletics Championships.",54357.0,East Asia,China,"Wuhan, Hubei",,https://upload.wikimedia.org/wikipedia/commons/thumb/6/6d/Wuhan_Sport_Centre_01.jpg/150px-Wuhan_Sport_Centre_01.jpg,"(30.50246795, 114.16612807957725)"
168,169.0,BC Place Stadium,"BC Place is a multi-purpose stadium in Vancouver, British Columbia, Canada. Located at the north side of False Creek, it is owned and operated by the BC Pavilion Corporation , a crown corporation of the province. -The venue is currently the home of the BC Lions of the Canadian Football League , Vancouver Whitecaps FC of Major League Soccer , the annual Canada Sevens , as well as the BC Sports Hall of Fame.",54320.0,North America,Canada,"Vancouver, British Columbia","Vancouver Whitecaps FC, BC Lions",https://upload.wikimedia.org/wikipedia/commons/thumb/f/ff/BC_Place_2015_Women%27s_FIFA_World_Cup.jpg/150px-BC_Place_2015_Women%27s_FIFA_World_Cup.jpg,"(49.2770655, -123.1095645)"
169,170.0,Yankee Stadium,"Yankee Stadium is a baseball stadium located in the Bronx in New York City. It is the home field of Major League Baseball’s New York Yankees and New York City FC of Major League Soccer. -The stadium opened in April 2009, replacing the original Yankee Stadium that operated from 1923 to 2008; it is situated on the 24-acre  former site of Macombs Dam Park, one block north of the original stadium's site. The new Yankee Stadium replicates design elements of the original Yankee Stadium, including its exterior and trademark frieze, while incorporating larger spaces and modern amenities. It has the sixth-largest seating capacity among the 30 stadiums of Major League Baseball.",54251.0,North America,United States,New York City,"New York Yankees, New York City FC",https://upload.wikimedia.org/wikipedia/commons/thumb/5/5f/YankeeStadium-9-21-22-1.jpg/150px-YankeeStadium-9-21-22-1.jpg,"(40.82958275, -73.92652118491901)"
170,171.0,Hrazdan Stadium,"Hrazdan Stadium  is a multi-use, all-seater stadium in Yerevan, Armenia, opened in 1970. Being the largest sports venue in Armenia, Hrazdan was mostly used for football matches. It was the home stadium of the Armenia national football team until 1999 and has hosted the occasional international game since then. The stadium is able to host 54,208 spectators after the most recent reconstruction in 2008, which converted the stadium into an all-seater one. Before the reconstruction, Hrazdan was able to hold up to 70,000 spectators. It was among the top four stadiums of the Soviet Union by its capacity. The stadium hosted the Armenian Cup finals on many occasions, as well as the opening ceremony of the Pan-Armenian Games in 2003. The Soviet Union national team played two games, against Finland and Greece, in Hrazdan in 1978.",54208.0,West Asia,Armenia,Yerevan,"FC Ararat Yerevan, Ulisses FC",https://upload.wikimedia.org/wikipedia/commons/thumb/7/71/HrazdanArmeniaTurkey.JPG/150px-HrazdanArmeniaTurkey.JPG,"(40.18036705, 44.494672292188596)"
171,172.0,BORUSSIA-PARK,"Borussia-Park  ⓘ; stylised as Stadion im BORUSSIA-PARK) is a football stadium in Mönchengladbach, North Rhine-Westphalia, Germany which serves as the home stadium of Bundesliga club Borussia Mönchengladbach.  -It replaced the smaller Bökelbergstadion, which no longer satisfied modern safety standards and international requirements, in July 2004.",54057.0,Europe,Germany,Mönchengladbach,Borussia Mönchengladbach,https://upload.wikimedia.org/wikipedia/commons/thumb/5/5d/Borussia-Park_DEU-FRA_2011.jpg/150px-Borussia-Park_DEU-FRA_2011.jpg,"(51.174624949999995, 6.385409367871812)"
172,173.0,Moses Mabhida Stadium,"The Moses Mabhida Stadium is a soccer stadium in Durban in the KwaZulu-Natal province of South Africa, named after Moses Mabhida, a former general secretary of the South African Communist Party. A multi-use stadium, it became a venue for several events, like bungee jumping, concerts, cricket, soccer, golf practise, motorsports and rugby union. -It was one of the host stadiums for the 2010 FIFA World Cup. The stadium has a capacity of 55,500 . The stadium is adjacent to the Kings Park Stadium, in the Kings Park Sporting Precinct, and the Durban street circuit used for the A1GP World Cup of Motorsport.  It includes a sports institute, and a transmodal transport station.",54000.0,Africa,South Africa,"Durban, KwaZulu-Natal","AmaZulu FC, Cell C Durban Sharks",https://upload.wikimedia.org/wikipedia/commons/thumb/9/9c/FIFA_World_Cup_2010_Netherlands_Japan.jpg/150px-FIFA_World_Cup_2010_Netherlands_Japan.jpg,"(-29.8290201, 31.03137408601279)"
173,174.0,Busan Asiad Main Stadium,"Busan Asiad Main Stadium  is a multi-purpose stadium in Busan, South Korea. It was built for the 2002 Asian Games and was also used for matches at the 2002 FIFA World Cup. It has a capacity of 53,769. The stadium hosted the opening and closing ceremonies of the 2002 Asian Games and was also the venue of athletics events during the games. It is the home venue of the K League club Busan IPark.",53864.0,East Asia,South Korea,Busan,Busan IPark,https://upload.wikimedia.org/wikipedia/commons/thumb/7/73/BusanAsiadStadium.jpg/150px-BusanAsiadStadium.jpg,"(35.1900767, 129.05954814285263)"
174,175.0,Estádio Estadual Jornalista Edgar Augusto Proença,"The Estádio Olímpico do Pará, also known as Mangueirão, is a football stadium in Belém, Pará, Brazil. It has a current seated capacity of 53,635, making it the ninth-largest football stadium in Brazil by capacity. The stadium is mainly used for football matches between the major football clubs in Pará, including Paysandu, Remo and Tuna Luso.",53645.0,South America,Brazil,"Belém, Pará","Paysandu SC, Clube do Remo, Tuna Luso Brasileira, SC Belem",https://upload.wikimedia.org/wikipedia/commons/thumb/6/6e/Mangueir%C3%A3o_em_2023.jpg/150px-Mangueir%C3%A3o_em_2023.jpg,"(-1.3811727, -48.44393180727559)"
175,176.0,Estadio Único Diego Armando Maradona,"Opened on June 7, 2003, the stadium was considered ""the most modern of Latin America"", even without having completed all of the planned construction. Its tenants include Estudiantes LP whose own stadium, the Estadio Jorge Luis Hirschi, was declared unsafe in 2005, and Gimnasia y Esgrima LP. Gimnasia returned to their original stadium  in mid-2008. -It is located between 32nd and 526th avenues, 25 Street and 21. These fields also contain a small rugby union stadium and a center for Physical Education, which tend to be intercollegiate events with schools in the area, such as the school No. 31, better known as the Saint Martin Commercial.",53600.0,South America,Argentina,La Plata,,https://upload.wikimedia.org/wikipedia/commons/thumb/8/88/EstadioUnicoLaPlata_Interior_June2014.jpg/150px-EstadioUnicoLaPlata_Interior_June2014.jpg,"(-34.913840750000006, -57.989047624769114)"
176,177.0,Adelaide Oval,"The Adelaide Oval is a sports ground in Adelaide, South Australia, located in the parklands between the city centre and North Adelaide. The venue is predominantly used for cricket and Australian rules football, but has also played host to rugby league, rugby union, soccer, tennis among other sports as well as regularly being used to hold concerts. Austadiums.com described Adelaide Oval as being ""one of the most picturesque Test cricket grounds in Australia, if not the world."" After the completion of the ground's most recent redevelopment in 2014, sports journalist Gerard Whateley described the venue as being ""the most perfect piece of modern architecture because it's a thoroughly contemporary stadium with all the character that it's had in the past."" -Australia South Australia Adelaide Strikers",53500.0,Oceania,Australia,"Adelaide, South Australia","Adelaide Crows, Port Adelaide Powers",https://upload.wikimedia.org/wikipedia/commons/thumb/a/a3/After_Game_Kick_and_Catch_%2813750115664%29.jpg/150px-After_Game_Kick_and_Catch_%2813750115664%29.jpg,"(-34.9155596, 138.59627721943045)"
177,178.0,Docklands Stadium,"Docklands Stadium, known by naming rights sponsorship as Marvel Stadium, is a multi-purpose sports and entertainment stadium in the suburb of Docklands in Melbourne, Victoria, Australia. Construction started in October 1997 and was completed in 2000 at a cost of A$460 million ). The stadium features a retractable roof and the ground level seating can be converted from oval to rectangular configuration. -Essendon Football Club St Kilda Football Club Western Bulldogs North Melbourne Football Club Carlton Football Club",53359.0,Oceania,Australia,"Melbourne, Victoria","Western Bulldogs, Essendon, St. Kilda, Carlton, North Melbourne",https://upload.wikimedia.org/wikipedia/commons/thumb/7/71/Melbourne_Derby_December_2014.jpg/150px-Melbourne_Derby_December_2014.jpg,"(-37.816529, 144.94751697668812)"
178,179.0,Estádio Municipal João Havelange,"The Estádio Municipal Parque do Sabiá, also known as Parque do Sabiá , is a multi-use stadium in Uberlândia, Brazil. It is currently used mostly for football matches. It is the home ground of Uberlândia Esporte Clube and Clube Atlético Portal, and is the biggest stadium in Minas Gerais state countryside. The stadium was built in 1982 and is able to hold 53,350 people. It is owned by the Uberlândia City Hall.",53350.0,South America,Brazil,"Uberlândia, Minas Gerais",Uberlânia EC,https://upload.wikimedia.org/wikipedia/commons/thumb/2/2f/Est%C3%A1dio_Parque_do_Sabi%C3%A1.jpg/150px-Est%C3%A1dio_Parque_do_Sabi%C3%A1.jpg,"(-18.9188041, -48.2767837)"
179,180.0,San Mamés,"The San Mamés Stadium  is an all-seater football stadium in Rafael Moreno Pitxitxi Kalea, Bilbao, Basque Country, Spain. Inaugurated on 16 September 2013, the stadium replaced the ""old"" San Mamés as the home of Athletic Bilbao. With a capacity of 53,331 seats, San Mamés is the 7th-largest stadium in Spain and the largest in the Basque Country.",53332.0,Europe,Spain,Bilbao,Athletic Bilbao,https://upload.wikimedia.org/wikipedia/commons/thumb/f/f8/San_Mames%2C_Bilbao%2C_Euskal_Herria_-_Basque_Country.jpg/150px-San_Mames%2C_Bilbao%2C_Euskal_Herria_-_Basque_Country.jpg,"(43.26420400000001, -2.94939145292929)"
180,181.0,Aleppo International Stadium,"The Aleppo International Stadium  is an Olympic-standard, multi-use, all-covered and all-seater stadium in the Syrian city of Aleppo. It is the largest stadium in Syria, and is currently used mostly for football matches. It serves as the home ground of Al-Ittihad football club. The stadium has also hosted some home games of the Syrian national football team. The stadium was opened in 2007 and holds up to  53,200 spectators. The venue is located near the al-Hamadaniah Sports City in the southwestern part of Aleppo.",53200.0,West Asia,Syria,Aleppo,Al-Ittihad,https://upload.wikimedia.org/wikipedia/commons/thumb/b/be/Aleppo_International_Stadium%2C_day_view%2C_2009_%281%29.jpg/150px-Aleppo_International_Stadium%2C_day_view%2C_2009_%281%29.jpg,"(36.1849318, 37.11764183655198)"
181,182.0,Estadio Nacional,"The National Stadium of Peru  is a multi-purpose stadium located in Lima, Peru. Its current capacity is 50,086 seats as stated by the Peruvian Football Federation without the lodges for some thousands more. The stadium was first inaugurated on 27 October 1952 for the 1953 South American Championship—replacing the Stadium Nacional—and is Peru's principal and national stadium. It has hosted three of the six South American Championship/Copa América football competitions held in Peru. It is referred to as the Coloso de José Díaz because of its proximity to a street of the same name. It is the home ground of the Peru national football team. The IPD —a branch of the Ministry of Education—is the stadium's administrating entity. The stadium has undergone several renovations for tournaments such as the 2004 Copa América. The artificial turf was installed for the 2005 FIFA U-17 World Championship. The most recent renovation started in 2010 and concluded in 2011. The re-inauguration ceremony of the renovated stadium was held on 24 July 2011 with a match between the Peru national under-20 football team and the Spain national under-20 football team.",53086.0,South America,Peru,Lima,Peru national football team,https://upload.wikimedia.org/wikipedia/commons/thumb/b/b8/Estadio_Nacional_nuevo_07_10_2011.jpg/150px-Estadio_Nacional_nuevo_07_10_2011.jpg,"(-12.0673803, -77.03378302724295)"
182,183.0,Huanglong Stadium,"The center, built between 1997 and 2003, includes an association football stadium with a running track, an indoor arena, outdoor track and field practice facility, a sports hotel, a press center, and other facilities for sports such as rhythmic gymnastics, tennis, diving and chess. -The stadium is one of the main sports venues in Hangzhou, together with the 14,000-capacity Jianggan District Culture and Sports Center Stadium and the 80,000-capacity Hangzhou Sports Park Stadium.",52672.0,East Asia,China,"Hangzhou, Zhejiang",Hangzhou FC,https://upload.wikimedia.org/wikipedia/commons/thumb/5/53/Hangzhou-yellow-dragon-stad.jpg/150px-Hangzhou-yellow-dragon-stad.jpg,"(30.2489634, 120.2052342)"
183,184.0,RAMS Park,"Uzunlar Ortak Girişimi -Rams Park was the first stadium in Turkey that met the UEFA Euro 2016 requirements during the country's bid to host the European Championship. In 2011, Rams Park was one of the six nominees for the Venue of the Year and New Venue categories of the Stadium Business Awards. Galatasaray S.K. won the Süper Lig in the first season at Rams Park. Rams Park and Galatasaray S.K. were mentioned in the first chapter of Tom Clancy's 2012 novel Threat Vector.",52652.0,Europe,Turkey,Istanbul,Galatasaray,https://upload.wikimedia.org/wikipedia/commons/thumb/d/d7/Galatasaray_Arena_North-West_Corner.jpg/150px-Galatasaray_Arena_North-West_Corner.jpg,"(41.10342555, 28.99103795029205)"
184,185.0,Suncorp Stadium,"Lang Park, nicknamed ""The Cauldron"", also known as Brisbane Stadium and commercially Suncorp Stadium, is a multi-purpose stadium in Brisbane, Queensland, Australia, located in the suburb of Milton. The current facility comprises a three-tiered rectangular sporting stadium with a capacity of 52,500 people. The traditional home of rugby league in Brisbane, the modern stadium is also now used for rugby union and soccer and has a rectangular playing field of 136 by 82 metres . The stadium's major tenants are the Brisbane Broncos, the Dolphins, the Queensland Reds and the Queensland Maroons. -Lang Park was established in 1914, on the site of the former North Brisbane Cemetery; in its early days it was home to a number of different sports, including cycling, athletics and soccer. The lease of the park was taken over by the Brisbane Rugby League in 1957, before it became the home of the game in Queensland . It has also been the home ground of major rugby union and soccer matches in Queensland since its modern redevelopment, including the Queensland Reds and the Brisbane Roar, as well as some Wallabies, Matildas and Socceroos matches. It hosted the 2008 and 2017 Rugby League World Cup finals, besides the 2021 NRL Grand Final. In addition to this, the ground hosted Rugby World Cup quarter finals and two Super Rugby grand finals, with the Queensland Reds winning on both occasions. The venue hosted several matches for the 2023 FIFA Women's World Cup including the third-place match, and will host the soccer tournament at the 2032 Summer Olympics, including the gold medal matches in both the men's and women's events. It will also be the 2032 Summer Olympics main venue, as the opening and closing ceremonies venue.",52500.0,Oceania,Australia,"Brisbane, Queensland","Brisbane Broncos, Queensland Maroons, Brisbane Roar FC, Queensland Reds",https://upload.wikimedia.org/wikipedia/commons/thumb/4/46/Suncorpstadium071006a.JPG/150px-Suncorpstadium071006a.JPG,"(-27.46486025, 153.0096055)"
