,rank,stadium,description,capacity,region,country,city,home_team,image_url,location
253,254.0,Neo Química Arena,"Arena Corinthians, also known as the Neo Química Arena for sponsorship reasons, is a sports stadium located in São Paulo, Brazil. It is owned, operated, and used by Corinthians. It has a seating capacity of 47,252, making it the fifth-largest stadium used by teams in the top tier of the Brazilian League and 14th-largest stadium in Brazil. -It hosted six matches during the 2014 FIFA World Cup, including the opening match on 12 June 2014. Because of a requirement for it to have at least 65,000 seats for the World Cup opening match, temporary seats were added to the stadium for the tournament. The temporary seats started to be removed shortly after its last World Cup match.",47605.0,South America,Brazil,"São Paulo, São Paulo",Corinthians,https://upload.wikimedia.org/wikipedia/commons/thumb/6/64/Corinthians_x_Gr%C3%AAmio_-_Brasileir%C3%A3o_2016.jpg/150px-Corinthians_x_Gr%C3%AAmio_-_Brasileir%C3%A3o_2016.jpg,"(-23.5452934, -46.474286436433154)"
254,255.0,Rogers Centre,"Rogers Centre  is a retractable roof stadium in Downtown Toronto, Ontario, Canada, situated at the base of the CN Tower near the northern shore of Lake Ontario. Opened in 1989 on the former Railway Lands, it is home to the Toronto Blue Jays of Major League Baseball . Previously, the stadium was also home to the Toronto Argonauts of the Canadian Football League  and the Toronto Raptors of the National Basketball Association . The Buffalo Bills of the National Football League  played an annual game at the stadium as part of the Bills Toronto Series from 2008 to 2013. While it is primarily a sports venue, it also hosts other large events such as conventions, trade fairs, concerts, travelling carnivals, circuses and monster truck shows. -The stadium was renamed ""Rogers Centre"" following the 2005 purchase of the stadium by Rogers Communications, the corporation that also owns the Toronto Blue Jays. The venue is noted for being the first stadium to have a fully retractable motorized roof, as well as for the 348-room hotel attached to it with 70 rooms overlooking the field. It is also the last North American major-league stadium built to accommodate both football and baseball. The stadium served as the site of both the opening and closing ceremonies of the 2015 Pan American Games .",47568.0,North America,Canada,"Toronto, Ontario","Toronto FC, Toronto Argonauts",https://upload.wikimedia.org/wikipedia/commons/thumb/7/79/Toronto_-_ON_-_Rogers_Centre2.jpg/150px-Toronto_-_ON_-_Rogers_Centre2.jpg,"(43.641659849999996, -79.38919761915824)"
255,256.0,Estadio Monumental,"The Estadio Monumental is a football Stadium in Macul, south-east of the centre of the Chilean capital Santiago. It serves as the home ground of Colo-Colo, and on occasions also for other clubs and the national football team. The stadium has a current spectator capacity of 47,347. The actual playing field is named after David Arellano, the founder of Colo-Colo; therefore, on occasions the whole stadium is referred to as Estadio Monumental David Arellano.",47347.0,South America,Chile,Santiago,Colo-Colo,https://upload.wikimedia.org/wikipedia/commons/thumb/0/0e/Estadio_Monumental_2009.jpg/150px-Estadio_Monumental_2009.jpg,"(-33.50643725, -70.60594681068619)"
256,257.0,Stadio Artemio Franchi,"The Stadio Artemio Franchi is a football stadium in Florence, Italy. It is currently the home of ACF Fiorentina. The old nickname of the stadium was ""Comunale"". When it was first constructed, it was known as the Stadio Giovanni Berta, after Florentine fascist Giovanni Berta. -The stadium was officially opened on 13 September 1931 with a match between Fiorentina and Admira Wien , though it took until 1932 for the stadium to be completely finished and currently holds 47,282. The architect is Pier Luigi Nervi  and it is one of the most relevant examples of 20th-century architecture in the city. It hosted some of the matches of the 1934 World Cup, as well as football preliminaries for the 1960 Summer Olympics in Rome. In 1945, it hosted the Spaghetti Bowl between American service teams.",47282.0,Europe,Italy,Florence,ACF Fiorentina,https://upload.wikimedia.org/wikipedia/commons/thumb/a/aa/Soccer_in_Florence%2C_Italy%2C_2007.jpg/150px-Soccer_in_Florence%2C_Italy%2C_2007.jpg,"(43.78088375, 11.282819064944935)"
257,258.0,Estadio Ciudad de Lanús – Néstor Díaz Pérez,"The stadium is named after Néstor Díaz Pérez, former president of the club under whose mandate the stadium was built.",47027.0,South America,Argentina,Lanús,CA Lanús,https://upload.wikimedia.org/wikipedia/commons/thumb/1/1e/Editat%C3%B3n_Club_Lan%C3%BAs_-_Instalaciones_%288%29.JPG/150px-Editat%C3%B3n_Club_Lan%C3%BAs_-_Instalaciones_%288%29.JPG,"(-34.71765845, -58.38395616411901)"
258,259.0,Estadio Metropolitano Roberto Meléndez,"Estadio Metropolitano Roberto Meléndez, commonly known as Estadio Metropolitano, or colloquially, El Metro, is a multi-use all-seater football stadium in Barranquilla, Colombia. It is the home stadium of local football team Atlético Junior. It was built with a capacity of 46,788 for the Colombian World Cup bid in 1986.  The stadium was inaugurated that year with a game between Uruguay and Junior, which the Uruguayans won 2–1. It is the largest stadium in Colombia, after the Estadio Deportivo Cali's renovation. The first official name of the stadium was Estadio Metropolitano, which was changed around 1991 in order to honor the Colombian footballer Roberto Meléndez. This is the official stadium for the national football team of Colombia.",46788.0,South America,Colombia,Barranquilla,"Colombia national football team, Atlético Junior",https://upload.wikimedia.org/wikipedia/commons/thumb/b/b0/Estadio_Metropolitano_de_Baranquilla_2011.jpg/150px-Estadio_Metropolitano_de_Baranquilla_2011.jpg,"(10.9269548, -74.80051110893285)"
259,260.0,Estádio Olímpico Nilton Santos,"Estádio Olímpico Nilton Santos is a multi-purpose stadium located in the neighbourhood of Engenho de Dentro in Rio de Janeiro, Brazil. It is used mostly for football matches and athletics and is the home stadium of the football club Botafogo. The stadium was built by a consortium under the leadership of Odebrecht S.A., from 2003 through to 2007, opening in time for the 2007 Pan American Games. It hosted the athletics competitions at the 2016 Summer Olympics and the 2016 Summer Paralympics. It was one of the five venues for the 2021 Copa América. -The stadium is known by a number of names. The nickname Engenhão ) refers to the location of the stadium. The stadium was named after former FIFA president and International Olympic Committee  member João Havelange . Havelange died after an attack of pneumonia during the 2016 Olympics at age 100. Between 2015 and 2017 the Rio municipality allowed Botafogo to refer to the stadium as Estádio Nilton Santos . The name honors Nílton Santos, whom spent his whole career with Botafogo and is regarded as one of the greatest defenders in the history of the game and a member of the World Team of the 20th Century. Botafogo made initial efforts to have the name change official but this was not immediately successful. In February 2017, the city of Rio de Janeiro officially renamed the stadium Estádio Olímpico Nilton Santos. Structural problems in the roof were identified in March 2013 that caused the stadium to be closed for repair. The stadium's capacity was increased to 60,000 for the Games.",46831.0,South America,Brazil,"Rio de Janeiro, Rio de Janeiro",Botafogo FR,https://upload.wikimedia.org/wikipedia/commons/thumb/a/a8/Est%C3%A1dio_Municipal_Jo%C3%A3o_Havelange_14072007.jpg/150px-Est%C3%A1dio_Municipal_Jo%C3%A3o_Havelange_14072007.jpg,"(-22.893194, -43.29356908690929)"
260,261.0,Itaipava Arena Pernambuco,"Arena Pernambuco , officially named Estádio Governador Carlos Wilson Campos, is a multi-use stadium with a capacity of 45,440 spectators located in the western suburbs of the Recife metropolitan area, in São Lourenço da Mata, Brazil. It is mostly used for football matches and was notably used to host some matches during the 2014 FIFA World Cup. -In 2012 Clube Náutico Capibaribe, one of three professional football clubs in the Recife metro area, signed an agreement to become part owners of the new stadium. In July 2013, Clube Náutico Capibaribe started to play all of their home games at Itaipava Arena Pernambuco. The stadium was previously known as Itaipava Arena Pernambuco under a sponsorship arrangement with brewing company Grupo Petrópolis between 2013 and 2016.",46154.0,South America,Brazil,"São Lourenço da Mata, Pernambuco",Náutico,https://upload.wikimedia.org/wikipedia/commons/thumb/6/62/Panorama_of_Arena_Pernambuco.jpg/150px-Panorama_of_Arena_Pernambuco.jpg,"(-8.04072965, -35.0082334311598)"
261,262.0,Arena MRV,"Arena MRV is a football stadium located in the Brazilian city of Belo Horizonte. The arena belongs to Clube Atlético Mineiro, which hosts its home games there.",46000.0,South America,Brazil,"Belo Horizonte, Minas Gerais",C Atlético Mineiro,https://upload.wikimedia.org/wikipedia/commons/thumb/5/54/Arena_MRV_em_obras_vista_da_Via_Expressa_%28dezembro_de_2022%29.jpg/150px-Arena_MRV_em_obras_vista_da_Via_Expressa_%28dezembro_de_2022%29.jpg,"(-19.9300116, -44.01388130198211)"
262,263.0,Estádio Paulo Constantino,"Estádio Paulo Constantino, most commonly known as Prudentão, and formerly as Estádio Eduardo José Farah, or simply Farahzão, is a multi-use stadium in Presidente Prudente, in the state of São Paulo, Brazil. It is currently used mostly for football matches. The stadium holds 45,954. It was built in 1982. The stadium is owned by the Presidente Prudente City Hall, and its formal name honored Eduardo José Farah, who was the Paulista Football Federation president during the stadium reformation. Oeste Paulista Esporte Clube usually plays their home matches at the stadium.",45954.0,South America,Brazil,"Presidente Prudente, São Paulo",Grêmio Prudente,https://upload.wikimedia.org/wikipedia/commons/thumb/c/c0/Derby_Paulista_%28Corinthians-Palmeiras%29_Paulist%C3%A3o_2009.jpg/150px-Derby_Paulista_%28Corinthians-Palmeiras%29_Paulist%C3%A3o_2009.jpg,"(-22.098568, -51.415062142450765)"
263,264.0,Estadio Atanasio Girardot,"Atanasio Girardot Sports Complex  is a sports complex located in Medellín, Colombia. The complex includes Estadio Atanasio Girardot, Medellín Sports Coliseum, Luis Alberto Villegas Stadium, and Alfonso Galvis Duque Stadium.",45739.0,South America,Colombia,Medellín,"Atlético Nacional, Independiente Medellín",https://upload.wikimedia.org/wikipedia/commons/thumb/4/4a/Atanasio_Girardot_Stadium.jpg/150px-Atanasio_Girardot_Stadium.jpg,"(6.2567716, -75.59016944999999)"
264,265.0,Estadio Ramón Sánchez Pizjuán,"The Ramón Sánchez Pizjuán Stadium ) is a football stadium in Seville, Spain. It is the home stadium of Sevilla, and is named after the club's former president, Ramón Sánchez-Pizjuán . -It was the venue for the 1986 European Cup Final between Steaua București and Barcelona and the 1982 World Cup semi-final game between West Germany and France. It was also the venue for the 2022 Europa League final between Eintracht Frankfurt and Rangers.",45500.0,Europe,Spain,Seville,Sevilla FC,https://upload.wikimedia.org/wikipedia/commons/thumb/1/17/Sevilla2-1Lega20182.jpg/150px-Sevilla2-1Lega20182.jpg,"(37.3840876, -5.970630902457186)"
265,266.0,Adrar Stadium,"The stadium was inaugurated on October 11, 2013, with a friendly match between local side Hassania Agadir and Algerian club JS Kabylie. Hassania's Saad Lemti scored the first goal in the stadium in the 76th minute of the match, as the hosts went on to win the match 1–0.",45480.0,Africa,Morocco,Agadir,Hassania Agadir,https://upload.wikimedia.org/wikipedia/commons/thumb/5/51/Stade-Adrar2019.png/150px-Stade-Adrar2019.png,"(30.4274409, -9.54025399460571)"
266,267.0,Lukoil Arena,"Lukoil Arena , former Otkritie Bank Arena  and Otkritie Arena , also known as Spartak Stadium  , is a multi-purpose stadium north-west of Moscow, Russia. The venue is used mostly for football matches, hosting the home matches of Spartak Moscow. -The stadium is designed with a capacity of 45,360 people. It has been used for select matches of Russian national football team.",45360.0,Europe,Russia,Moscow,Spartak Moscow,https://upload.wikimedia.org/wikipedia/commons/thumb/6/62/Match_veteranov_Spartaka_%2813%29.jpg/150px-Match_veteranov_Spartaka_%2813%29.jpg,"(55.81758845, 37.440609927920065)"
267,268.0,Grand stade de Marrakech,"Completed in January 2012, it is used mostly for football matches with the capability of hosting Olympic Games. It is home to Kawkab Marrakesh football team. The stadium has a capacity for 41,356 spectators. It replaces Stade Al Harti as the home of Kawkab Marrakech and as the main stadium of the city. -It hosted the 2014 IAAF Continental Cup, four games including the final in the 2014 FIFA Club World Cup, and the 2014 African Championships in Athletics.",45240.0,Africa,Morocco,Marrakesh,Kawkab Marrakech,https://upload.wikimedia.org/wikipedia/commons/thumb/0/0d/Stade_de_marrakech.jpg/150px-Stade_de_marrakech.jpg,"(31.707014299999997, -7.980359)"
268,269.0,Mandela National Stadium,"The Mandela National Stadium is a multi-purpose stadium in Uganda. It is named after the former South African President and anti-apartheid icon, Nelson Mandela. The stadium's record attendance of 50,000 was set in 2004, in a football match between the national football teams of Uganda and South Africa.",45202.0,Africa,Uganda,Kampala,Uganda national football team,https://upload.wikimedia.org/wikipedia/commons/thumb/3/3c/Mandela_National_Stadium%2C_Uganda.JPG/150px-Mandela_National_Stadium%2C_Uganda.JPG,"(0.3177137, 32.5813539)"
269,270.0,Tarczyński Arena Wrocław,The Wrocław Stadium is the largest arena in Ekstraklasa and the third largest in the country . -Stadium construction began in April 2009 and was completed in September 2011.,45105.0,Europe,Poland,Wrocław,Śląsk Wrocław,https://upload.wikimedia.org/wikipedia/commons/thumb/a/a3/Wroc%C5%82aw_Municipal_Stadium_-_Euro_2012_%28panorama%29.jpg/150px-Wroc%C5%82aw_Municipal_Stadium_-_Euro_2012_%28panorama%29.jpg,"(51.141186149999996, 16.943806687526074)"
270,271.0,Kazan Arena,"Ak Bars Arena ) is a stadium in Kazan, Russia.  It was completed in July 2013, and hosts football matches, especially FC Rubin Kazan's home games in the Russian Premier League. The stadium has the largest outside screen in the world. Its capacity is around 45,379.",45105.0,Europe,Russia,Kazan,Rubin Kazan,https://upload.wikimedia.org/wikipedia/commons/thumb/5/56/Poland_v._Colombia_%2842095441565%29.jpg/150px-Poland_v._Colombia_%2842095441565%29.jpg,"(55.8231963, 49.1641317)"
271,272.0,Estadio Inca Garcilaso de la Vega,"The increase in spectator capacity came after CONMEBOL chose Peru to host the Copa América 2004, prompting the Peruvian government to invest in a five-million dollar renovation program for its stadia, including the Estadio Garcilaso de la Vega. Its renovation cost approximately $1,720,000, which helped boost its official spectator capacity to 42,056. The stadium ended up hosting the third place game of the Copa América 2004. Thanks to the event, the city of Cusco received even more tourists than it already receives as Peru's top tourist destination. -The Estadio Garcilaso de la Vega is also recognized as one of the most beautiful stadiums in all of South America. This recognition is due to its well-maintained grass and its resistance to the sometimes aggressive and highly variable climate of the city of Cuzco. The awe is the stadium's perpetual beauty even after these climates. It is this resistive beauty that inspires soccer commentators and visitors alike.",45056.0,South America,Peru,Cusco,"CS Cienciano, Deportivo Garcilaso, Cusco FC",https://upload.wikimedia.org/wikipedia/commons/thumb/1/10/Estadio_garcilaso_cienciano.jpg/150px-Estadio_garcilaso_cienciano.jpg,"(-13.5255188, -71.96647608840082)"
272,273.0,Estádio da Machava,"The stadium was built by the Portuguese colonial government of Mozambique and inaugurated as Estádio Salazar, named after the Portuguese dictator António de Oliveira Salazar, on 30 June 1968, with a match between Portugal and Brazil, which the latter, formally the visitors, won 2:0. -It was in Machava that the Declaration of National Independence of Mozambique took place, on June 25, 1975.",45000.0,Africa,Mozambique,Maputo,Mozambique national football team,https://upload.wikimedia.org/wikipedia/commons/thumb/0/0a/No-image-available.png/480px-No-image-available.png,"(-25.9174099, 32.52637884727005)"
273,274.0,Stadion Gelora Bung Tomo,"Gelora Bung Tomo Stadium is a multi-purpose stadium in Benowo, Surabaya, East Java, Indonesia. It is a part of the Surabaya Sports Center. The rest of the sports complex consists of an indoor stadium, a racing circuit, a roller skating track, three football training pitches, and a mosque. This stadium is used mostly for football matches. It replaced the older Gelora 10 November Stadium. The stadium is used for football matches and is a new base for Persebaya Surabaya. GBT can accommodate 46,806 spectators. The stadium is named after Bung Tomo, who is a National Hero of Indonesia.",45000.0,Southeast Asia,Indonesia,"Surabaya, East Java",Persebaya Surabaya,https://upload.wikimedia.org/wikipedia/commons/thumb/0/0a/No-image-available.png/480px-No-image-available.png,"(-7.2231559, 112.6227832992418)"
274,275.0,Stadion Harapan Banga,"Harapan Bangsa Stadium or Lhong Raya Stadium is a multi-use stadium in Banda Aceh, Aceh, Indonesia.  It is currently used mostly for football matches. The stadium holds 45,000 people.",45000.0,Southeast Asia,Indonesia,"Banda Aceh, Aceh","Persiraja, Aceh United",https://upload.wikimedia.org/wikipedia/commons/thumb/0/0a/No-image-available.png/480px-No-image-available.png,"(5.5528455, 95.3192908)"
275,276.0,Estadio General Pablo Rojas,"Estadio General Pablo Rojas, locally known as La Olla or La Nueva Olla and for sponsorship reasons known as Estadio ueno La Nueva Olla, is a football stadium in the neighbourhood of Barrio Obrero in Asunción, Paraguay. It is the home venue of Cerro Porteño. The stadium's nickname La Olla was given by the club's former president General Pablo Rojas, after whom the stadium was named when he died. This stadium was used during the 1999 Copa América, hosting games by Uruguay and Colombia. Since 2015, the stadium is undergoing expansion and remodeling works in order to increase its capacity to 51,237 people. The stadium counts with balconies, car parking, food courts and canteens in all sectors.",45000.0,South America,Paraguay,Asunción,Club Cerro Porteño,https://upload.wikimedia.org/wikipedia/commons/thumb/c/c4/Estadio_General_Pablo_Rojas.jpg/150px-Estadio_General_Pablo_Rojas.jpg,"(-25.2999926, -57.637655818084326)"
276,277.0,Stade Mohammed V,"It primarily hosts association football matches, serving as the home ground of the Morocco national football team and local rival football clubs Wydad AC and Raja CA. In 1997, the stadium set a record of attendance of 110,000 during the Casablanca football derby and a match between the Moroccan national team against Ghana. The same record attendance was repeated during Morocco's match against Argentina in 2004.",45000.0,Africa,Morocco,Casablanca,"Wydad, Raja",https://upload.wikimedia.org/wikipedia/commons/thumb/7/70/Stade_Mohamed_V%2C_Casablanca.jpg/150px-Stade_Mohamed_V%2C_Casablanca.jpg,"(33.5945144, -7.6200284)"
277,278.0,Latakia Sports City Stadium,"Latakia Sports City Stadium  is a multi-purpose stadium in Latakia, Syria. It is mostly used for football matches. With a capacity of 45,000 spectators, the stadium is the second largest sports venue in Syria. It was opened in 1987 as a part of the Latakia Sports City and became the main venue of the 10th Mediterranean Games in Latakia the same year.",45000.0,West Asia,Syria,Latakia,,https://upload.wikimedia.org/wikipedia/commons/thumb/0/0a/No-image-available.png/480px-No-image-available.png,"(35.5200185, 35.7781044)"
278,279.0,Zibo Sports Centre Stadium,"Zibo City Sports Centre Stadium is a football stadium in Zibo, China. It hosts football matches and hosted the 2010 AFC U-19 Championship. The stadium holds 45,000 spectators.",45000.0,East Asia,China,"Zibo, Shandong",,https://upload.wikimedia.org/wikipedia/commons/thumb/0/0a/No-image-available.png/480px-No-image-available.png,"(36.8132476, 117.98283842091442)"
279,280.0,Weifang Sports Centre Stadium,"Weifang Olympic Sports Centre Stadium was a football stadium in Weifang, China.  It hosts football matches and hosted some matches for the women's football competition at the 2009 National Games of China.  The stadium holds 45,000 spectators. The stadium was built in 2005 by Shen Yifei, a local firm, and has also been used for a variety of athletic and amusement events, in particular, stage shows. The stadium opened to the public in January 2006 and officially opened in May 2006. The venue officially hosted the third edition of the China National Games in 2007, which featured the sport of football. The stadium officially closed for good on 11 June 2006. It had been used to host a number of large-scale public events since its completion",45000.0,East Asia,China,"Weifang, Shandong",,https://upload.wikimedia.org/wikipedia/commons/thumb/0/0a/No-image-available.png/480px-No-image-available.png,"(36.729047550000004, 119.06309827876231)"
280,281.0,Yantai Sports Park Stadium,"The Yantai Sports Park Stadium is a multi-use stadium in Yantai, China. It is currently used mostly for association football matches, and also for athletics and rugby sevens. The stadium has a capacity of 40,000.",45000.0,East Asia,China,"Yantai, Shandong",,https://upload.wikimedia.org/wikipedia/commons/thumb/0/0a/No-image-available.png/480px-No-image-available.png,"(37.462892, 121.4535599361259)"
281,282.0,Stadium Tuanku Abdul Rahman,"The Tuanku Abdul Rahman Stadium , also known by its informal name Stadium Paroi or Paroi Stadium and nickname The STAR of Paroi, is a multi-purpose stadium in Paroi, Negeri Sembilan, Malaysia. It is currently used mostly for football matches. Inaugurated on April 23, 1992, the stadium initially held a capacity of 20,000 people. In 2004, the capacity of the stadium had been upgraded to 45,000 people for the hosting of the 2004 Sukma Games. It is currently home to the Negeri Sembilan Football Association. -The stadium is named in honor of Tuanku Abdul Rahman ibni Almarhum Tuanku Muhammad, the eighth Yamtuan Besar of Seri Menanti, the second Yang Di-Pertuan Besar of modern-day Negeri Sembilan, and the first Yang di-Pertuan Agong of Malaysia.",45000.0,Southeast Asia,Malaysia,Seremban,"ATM FA, Negeri Sembilan",https://upload.wikimedia.org/wikipedia/commons/thumb/f/f5/Stadium_Tuanku_Abdul_Rahman%2C_Paroi.jpg/150px-Stadium_Tuanku_Abdul_Rahman%2C_Paroi.jpg,"(2.72623985, 101.98261766370348)"
282,283.0,Stade du Complexe sportif de Fès,"The Fez Sports complex  is a multi-purpose stadium in Fez, Morocco. It is used mostly for football matches and it also has athletics facilities, the stadium holds 45,000 and was built in 2003.",45000.0,Africa,Morocco,Fes,"Wydad de Fès, Maghreb de Fès",https://upload.wikimedia.org/wikipedia/commons/thumb/1/1c/Complexe_sportif_de_F%C3%A8s.jpg/150px-Complexe_sportif_de_F%C3%A8s.jpg,"(34.00272, -4.968961820296855)"
283,284.0,Lagos National Stadium,"The Lagos National Stadium is a multi-purpose stadium in Surulere, Lagos State, Nigeria, which comprises an Olympic-size swimming arena and a multipurpose arena used for athletics, rugby union, basketball, volleyball, table tennis, wrestling and boxing matches.  It was used mostly for football matches until 2004. It hosted several international competitions including the 1980 African Cup of Nations final, the 2000 African Cup of Nations final, and FIFA World Cup qualifying matches. It also served as the main stadium for the 1973 All-Africa Games.",45000.0,Africa,Nigeria,Lagos,Nigeria national football team,https://upload.wikimedia.org/wikipedia/commons/thumb/0/0a/No-image-available.png/480px-No-image-available.png,"(6.49714245, 3.364988038941034)"
284,285.0,Egyptian Army Stadium,"The stadium was known as Mubarak International Stadium until 2011 and was changed to Egyptian Army Stadium as a result of the 2011 Egyptian revolution, which removed Hosni Mubarak from being the president of Egypt.",45000.0,Africa,Egypt,Suez,,https://upload.wikimedia.org/wikipedia/commons/thumb/0/0a/No-image-available.png/480px-No-image-available.png,"(29.974498, 32.537086)"
285,286.0,Toyota Stadium,"Toyota Stadium  is a stadium in Toyota, Aichi Prefecture, Japan. It has a retractable roof.",45000.0,East Asia,Japan,"Toyota City, Aichi","Nagoya Grampus, Toyota Verblitz",https://upload.wikimedia.org/wikipedia/commons/thumb/5/58/JPNxGEO20180623_%283%29.jpg/150px-JPNxGEO20180623_%283%29.jpg,"(35.083386, 137.156412)"
286,287.0,Zayed Sports City Stadium,"The largest stadium in the UAE with 45,000 seats, it was featured on the AED 200 banknote. -The stadium was opened in 1979 and was renovated in 2009, with many of the facilities and amenities upgraded to ensure that it complies with international standards and can be used for a wide range of events.",45000.0,West Asia,United Arab Emirates,Abu Dhabi,,https://upload.wikimedia.org/wikipedia/commons/thumb/a/a7/Abu_Dhabi_Zayed_Sports_City_Stadium_2.jpg/150px-Abu_Dhabi_Zayed_Sports_City_Stadium_2.jpg,"(24.416128649999997, 54.453630022086614)"
